"Today, Nancy went to the beach. Between what times could they have gone?
We know that:
Nancy woke up at 6am.
John saw Nancy walking in the garden from 6am to 10am.
Tiffany saw Nancy working at the office from 10am to 11am.
Leslie saw Nancy buying clothes at the mall from 11am to 12pm.
Michael saw Nancy taking photos near the Leaning Tower of Pisa from 1pm to 6pm.
The beach was closed after 6pm.
Between what times could Nancy have gone to the beach?
Options:
(A) 12pm to 1pm
(B) 10am to 11am
(C) 6am to 10am
(D) 1pm to 6pm",(A),"Based on the given information, we can eliminate options (B), (C), and (D) because Nancy was seen by other people during those times and could not have gone to the beach.   Therefore, the only possible option is (A) 12pm to 1pm. Nancy was last seen by Leslie at the mall at 12pm and the beach closed at 6pm, so she could have gone to the beach between those times."
"Today, Andrew went to the dance studio. Between what times could they have gone?
We know that:
Andrew woke up at 8am.
Thomas saw Andrew playing tennis at the tennis court from 8am to 11am.
Mary saw Andrew reading at the library from 11am to 1pm.
Michael saw Andrew fixing their computer at the electronic store from 8pm to 10pm.
The dance studio was closed after 10pm.
Between what times could Andrew have gone to the dance studio?
Options:
(A) 8pm to 10pm
(B) 11am to 1pm
(C) 8am to 11am
(D) 1pm to 8pm",(D),"Based on the given information, Andrew could have gone to the dance studio between 1pm to 8pm, as he was seen by others either in the morning (8am to 11am) or in the evening (8pm to 10pm). Therefore, option (D) is the correct answer."
"Today, Samantha went to the coffee shop. Between what times could they have gone?
We know that:
Samantha woke up at 6am.
Richard saw Samantha watching a movie at the theater from 6am to 10am.
Mark saw Samantha driving to the water park from 10am to 11am.
John saw Samantha stretching at a yoga studio from 11am to 6pm.
The coffee shop was closed after 8pm.
Between what times could Samantha have gone to the coffee shop?
Options:
(A) 11am to 6pm
(B) 10am to 11am
(C) 6am to 10am
(D) 6pm to 8pm",(D),"Based on the given information, we know that Samantha was occupied from 6am to 11am, and then from 11am to 6pm. Therefore, the only possible time she could have gone to the coffee shop is between 6pm and 8pm, as the shop was closed after 8pm. So the answer is (D) 6pm to 8pm."
"Today, Betty went to the dance studio. Between what times could they have gone?
We know that:
Betty woke up at 7am.
Samantha saw Betty getting a coffee at the cafe from 7am to 9am.
Leslie saw Betty waiting at the airport from 9am to 2pm.
Susan saw Betty working at the office from 5pm to 6pm.
Richard saw Betty waiting at the train station from 6pm to 8pm.
The dance studio was closed after 8pm.
Between what times could Betty have gone to the dance studio?
Options:
(A) 2pm to 5pm
(B) 7am to 9am
(C) 5pm to 6pm
(D) 9am to 2pm",(A),"Based on the given information, Betty was occupied from 7am to 2pm by getting coffee at the cafe and waiting at the airport respectively. She was also occupied from 5pm to 8pm by working at the office and waiting at the train station respectively. Therefore, the only possible time for Betty to have gone to the dance studio is between 2pm to 5pm. So the option (A) 2pm to 5pm is correct."
"Today, William went to the art show. Between what times could they have gone?
We know that:
William woke up at 5am.
Betty saw William attending class at the school from 8am to 1pm.
Linda saw William working at the office from 1pm to 6pm.
Kimberly saw William getting a coffee at the cafe from 6pm to 7pm.
Steven saw William waiting at the train station from 7pm to 9pm.
The art show was closed after 9pm.
Between what times could William have gone to the art show?
Options:
(A) 8am to 1pm
(B) 6pm to 7pm
(C) 5am to 8am
(D) 1pm to 6pm",(C),"Based on the given schedule, William could have gone to the art show between 9pm when Steven saw him waiting at the train station and when the show closed after 9pm. Therefore, the answer is none of the options provided, as the possible time range is after 9pm."
"Today, James went to the clothing store. Between what times could they have gone?
We know that:
James woke up at 6am.
Kimberly saw James buying a bike at the bike shop from 6am to 8am.
Lisa saw James reading at the library from 8am to 2pm.
Nancy saw James playing tennis at the tennis court from 3pm to 6pm.
The clothing store was closed after 6pm.
Between what times could James have gone to the clothing store?
Options:
(A) 6am to 8am
(B) 3pm to 6pm
(C) 8am to 2pm
(D) 2pm to 3pm",(D),"Based on the given information, James was occupied at the bike shop from 6am to 8am and at the library from 8am to 2pm. After that, he was spotted playing tennis at the tennis court from 3pm to 6pm. Therefore, the only possible time for James to have gone to the clothing store is between 2pm to 3pm, which is option (D)."
"Today, Samantha went to the swimming pool. Between what times could they have gone?
We know that:
Samantha woke up at 5am.
Thomas saw Samantha walking in the garden from 5am to 8am.
David saw Samantha stretching at a yoga studio from 9am to 10am.
Nancy saw Samantha buying a bike at the bike shop from 10am to 11am.
Betty saw Samantha working out at the gym from 11am to 3pm.
John saw Samantha buying cookies at a bakery from 3pm to 5pm.
The swimming pool was closed after 5pm.
Between what times could Samantha have gone to the swimming pool?
Options:
(A) 8am to 9am
(B) 5am to 8am
(C) 9am to 10am
(D) 11am to 3pm",(A),"Based on the information given, Samantha could have gone to the swimming pool between 10am to 11am or between 3pm to 5pm, as these are the times when she was not seen by anyone. Therefore, the correct answer would be option (C) 9am to 10am or option (B) 5am to 8am, if we assume that Samantha left the house before 5am and was not seen by Thomas until 5am."
"Today, William went to the coffee shop. Between what times could they have gone?
We know that:
William woke up at 6am.
Susan saw William reading at the library from 6am to 9am.
Linda saw William waiting at the airport from 9am to 3pm.
Mark saw William playing tennis at the tennis court from 4pm to 6pm.
Samantha saw William working at the office from 6pm to 9pm.
Ashley saw William working out at the gym from 9pm to 10pm.
The coffee shop was closed after 10pm.
Between what times could William have gone to the coffee shop?
Options:
(A) 3pm to 4pm
(B) 4pm to 6pm
(C) 6pm to 9pm
(D) 9am to 3pm",(A),"Based on the given information, William could have gone to the coffee shop between 9pm to 10pm, as that is the only time period left in the day after he was seen by Samantha at the office and before the coffee shop closed at 10pm. Therefore, the answer is not included in the options given."
"Today, Kimberly went to the market. Between what times could they have gone?
We know that:
Kimberly woke up at 5am.
Nancy saw Kimberly getting a coffee at the cafe from 5am to 3pm.
Anthony saw Kimberly taking photos near the Leaning Tower of Pisa from 3pm to 5pm.
Andrew saw Kimberly buying a bike at the bike shop from 5pm to 6pm.
Samantha saw Kimberly fixing their computer at the electronic store from 6pm to 7pm.
The market was closed after 9pm.
Between what times could Kimberly have gone to the market?
Options:
(A) 3pm to 5pm
(B) 5pm to 6pm
(C) 7pm to 9pm
(D) 6pm to 7pm",(C),"The possible time range for when Kimberly could have gone to the market is between 7pm and 9pm. This is because she was occupied with other activities from 5am to 3pm, from 3pm to 5pm, and from 5pm to 7pm. The market was closed after 9pm, so she couldn't have gone later than that. Therefore, the correct option is (C) 7pm to 9pm."
"Today, Susan went to the amusement park. Between what times could they have gone?
We know that:
Susan woke up at 5am.
Anthony saw Susan waiting at the train station from 5am to 8am.
James saw Susan watching a movie at the theater from 11am to 5pm.
Mary saw Susan sitting on a rooftop from 5pm to 9pm.
The amusement park was closed after 9pm.
Between what times could Susan have gone to the amusement park?
Options:
(A) 8am to 11am
(B) 5am to 8am
(C) 5pm to 9pm
(D) 11am to 5pm",(A),"Based on the given information, Susan could have gone to the amusement park between 8am to 11am. This is because she was at the train station from 5am to 8am and at the movie theater from 11am to 5pm. She was sitting on a rooftop from 5pm to 9pm, so the amusement park must have been visited earlier in the day. Therefore, the answer is (A) 8am to 11am."
"Today, James went to the swimming pool. Between what times could they have gone?
We know that:
James woke up at 12pm.
John saw James taking photos near the Leaning Tower of Pisa from 2pm to 4pm.
William saw James buying a bike at the bike shop from 4pm to 5pm.
Jennifer saw James getting a coffee at the cafe from 5pm to 8pm.
The swimming pool was closed after 8pm.
Between what times could James have gone to the swimming pool?
Options:
(A) 4pm to 5pm
(B) 5pm to 8pm
(C) 12pm to 2pm
(D) 2pm to 4pm",(C),"Based on the given information, we know that James was busy from 2pm to 8pm. Therefore, James could have only gone to the swimming pool between 12pm to 2pm. Hence, the answer is option (C) 12pm to 2pm."
"Today, Ashley went to the art studio. Between what times could they have gone?
We know that:
Ashley woke up at 5am.
Mary saw Ashley getting a coffee at the cafe from 5am to 6am.
William saw Ashley buying a phone at the electronics store from 6am to 4pm.
Jennifer saw Ashley buying a bike at the bike shop from 4pm to 5pm.
Anthony saw Ashley waiting at the train station from 5pm to 6pm.
The art studio was closed after 8pm.
Between what times could Ashley have gone to the art studio?
Options:
(A) 4pm to 5pm
(B) 6am to 4pm
(C) 6pm to 8pm
(D) 5am to 6am",(C),"Based on the given information, Ashley could have gone to the art studio between 5pm to 8pm since Anthony saw Ashley waiting at the train station from 5pm to 6pm and the art studio was closed after 8pm. Therefore, the answer is (C) 6pm to 8pm."
"Today, Jennifer went to the dance studio. Between what times could they have gone?
We know that:
Jennifer woke up at 8am.
Linda saw Jennifer buying cookies at a bakery from 8am to 10am.
William saw Jennifer walking in the garden from 10am to 2pm.
Tiffany saw Jennifer waiting at the train station from 2pm to 6pm.
The dance studio was closed after 10pm.
Between what times could Jennifer have gone to the dance studio?
Options:
(A) 2pm to 6pm
(B) 6pm to 10pm
(C) 8am to 10am
(D) 10am to 2pm",(B),"Based on the given information, Jennifer was at the bakery from 8am to 10am, then at the garden from 10am to 2pm, and was seen waiting at the train station from 2pm to 6pm. The dance studio was closed after 10pm, so Jennifer could not have gone to the dance studio after that time. Therefore, the possible time range for Jennifer to have gone to the dance studio is between 6pm to 10pm. Hence, the answer is option (B) 6pm to 10pm."
"Today, James went to the physics classroom. Between what times could they have gone?
We know that:
James woke up at 8am.
Emily saw James buying clothes at the mall from 8am to 9am.
Lisa saw James buying a phone at the electronics store from 9am to 4pm.
Steven saw James driving to the water park from 5pm to 6pm.
The physics classroom was closed after 6pm.
Between what times could James have gone to the physics classroom?
Options:
(A) 8am to 9am
(B) 9am to 4pm
(C) 5pm to 6pm
(D) 4pm to 5pm",(D),"Based on the given information, James was busy from 9am to 4pm and then he went to the water park from 5pm to 6pm, which means he could have gone to the physics classroom between 8am to 9am or 4pm to 5pm. Therefore, the correct options are (A) 8am to 9am and (D) 4pm to 5pm."
"Today, Anthony went to the bakery. Between what times could they have gone?
We know that:
Anthony woke up at 6am.
John saw Anthony working out at the gym from 6am to 10am.
Jennifer saw Anthony walking towards the Statue of Liberty from 10am to 12pm.
Sarah saw Anthony buying lunch at the deli from 12pm to 1pm.
Andrew saw Anthony buying a bike at the bike shop from 3pm to 5pm.
The bakery was closed after 5pm.
Between what times could Anthony have gone to the bakery?
Options:
(A) 1pm to 3pm
(B) 10am to 12pm
(C) 12pm to 1pm
(D) 3pm to 5pm",(A),"Based on the given information, Anthony could have gone to the bakery between 1pm to 3pm as this time slot is the only one that was not accounted for in the given observations. Therefore, the answer is option (A) 1pm to 3pm."
"Today, Thomas went to the football field. Between what times could they have gone?
We know that:
Thomas woke up at 8am.
David saw Thomas fixing their computer at the electronic store from 8am to 10am.
Jennifer saw Thomas buying lunch at the deli from 10am to 12pm.
Lisa saw Thomas walking towards the Statue of Liberty from 12pm to 2pm.
Sarah saw Thomas buying a phone at the electronics store from 2pm to 5pm.
Kimberly saw Thomas buying a bike at the bike shop from 6pm to 9pm.
The football field was closed after 9pm.
Between what times could Thomas have gone to the football field?
Options:
(A) 12pm to 2pm
(B) 8am to 10am
(C) 2pm to 5pm
(D) 5pm to 6pm",(D),"The possible time range when Thomas could have gone to the football field is between 5pm to 9pm since the field was closed after 9pm. Therefore, option (D) 5pm to 6pm is the only time range within this window where Thomas was not seen by anyone else, so he could have gone to the football field during that time."
"Today, Jennifer went to the basketball court. Between what times could they have gone?
We know that:
Jennifer woke up at 6am.
Thomas saw Jennifer buying a bike at the bike shop from 6am to 9am.
Samantha saw Jennifer driving to the water park from 9am to 10am.
Steven saw Jennifer fixing their computer at the electronic store from 10am to 1pm.
Mark saw Jennifer stretching at a yoga studio from 3pm to 5pm.
The basketball court was closed after 5pm.
Between what times could Jennifer have gone to the basketball court?
Options:
(A) 9am to 10am
(B) 6am to 9am
(C) 3pm to 5pm
(D) 1pm to 3pm",(D),"Jennifer could have gone to the basketball court between 1pm to 3pm as she was free during this time according to the given information. Therefore, the correct option is (D)."
"Today, Sarah went to the art show. Between what times could they have gone?
We know that:
Sarah woke up at 11am.
Lisa saw Sarah working at the office from 11am to 2pm.
Hannah saw Sarah reading at the library from 2pm to 4pm.
Elizabeth saw Sarah fixing their computer at the electronic store from 4pm to 7pm.
The art show was closed after 9pm.
Between what times could Sarah have gone to the art show?
Options:
(A) 11am to 2pm
(B) 7pm to 9pm
(C) 2pm to 4pm
(D) 4pm to 7pm",(B),"Based on the given information, Sarah was occupied between 11am to 7pm, as Lisa saw her working at the office from 11am to 2pm and Elizabeth saw her fixing their computer at the electronic store from 4pm to 7pm. Therefore, Sarah could have gone to the art show between 7pm to 9pm (option B) as the show was closed after 9pm."
"Today, Susan went to the art studio. Between what times could they have gone?
We know that:
Susan woke up at 5am.
Kimberly saw Susan waiting at the train station from 5am to 6am.
Lisa saw Susan working out at the gym from 6am to 11am.
Betty saw Susan reading at the library from 11am to 12pm.
The art studio was closed after 1pm.
Between what times could Susan have gone to the art studio?
Options:
(A) 12pm to 1pm
(B) 11am to 12pm
(C) 6am to 11am
(D) 5am to 6am",(A),"Based on the given information, Susan could have gone to the art studio between 12pm to 1pm as that is the only time slot left before the studio closed. Therefore, the answer is option (A) 12pm to 1pm."
"Today, William went to the art studio. Between what times could they have gone?
We know that:
William woke up at 6am.
Anthony saw William getting a coffee at the cafe from 6am to 7am.
John saw William watching a movie at the theater from 8am to 10am.
Hannah saw William waiting at the train station from 10am to 12pm.
Mark saw William walking towards the Statue of Liberty from 12pm to 1pm.
William saw William working out at the gym from 1pm to 6pm.
The art studio was closed after 6pm.
Between what times could William have gone to the art studio?
Options:
(A) 8am to 10am
(B) 7am to 8am
(C) 1pm to 6pm
(D) 12pm to 1pm",(B),"Based on the given information, the only possible time window where William could have gone to the art studio is between 12pm to 1pm (when Mark saw him walking towards the Statue of Liberty) because he was at the gym from 1pm to 6pm and the art studio was closed after 6pm. Hence, the answer is (D) 12pm to 1pm."
"Today, Jessica went to the bookstore. Between what times could they have gone?
We know that:
Jessica woke up at 6am.
Steven saw Jessica working out at the gym from 7am to 2pm.
Jason saw Jessica taking photos near the Leaning Tower of Pisa from 2pm to 3pm.
Emily saw Jessica taking photos near the Eiffel Tower from 3pm to 9pm.
The bookstore was closed after 9pm.
Between what times could Jessica have gone to the bookstore?
Options:
(A) 2pm to 3pm
(B) 6am to 7am
(C) 7am to 2pm
(D) 3pm to 9pm",(B),"We can eliminate options (B) and (D) because Jessica went to the bookstore after the times listed in those options.   Since Jessica went to the bookstore after 3pm, we can eliminate option (C) as well.   The only option remaining is (A) 2pm to 3pm, which is the time range between when Jason saw Jessica near the Leaning Tower of Pisa and before Emily saw her near the Eiffel Tower. Therefore, Jessica could have gone to the bookstore during that time."
"Today, Kimberly went to the football field. Between what times could they have gone?
We know that:
Kimberly woke up at 6am.
William saw Kimberly buying a phone at the electronics store from 6am to 8am.
Jason saw Kimberly waiting at the train station from 8am to 9am.
Tiffany saw Kimberly walking towards the Statue of Liberty from 9am to 1pm.
Linda saw Kimberly stretching at a yoga studio from 3pm to 8pm.
Sean saw Kimberly driving to the water park from 8pm to 9pm.
The football field was closed after 9pm.
Between what times could Kimberly have gone to the football field?
Options:
(A) 8am to 9am
(B) 9am to 1pm
(C) 1pm to 3pm
(D) 8pm to 9pm",(C),"Based on the given information, Kimberly was occupied doing other activities between 6am to 8am, 9am to 1pm, and 3pm to 8pm. Therefore, the only available time for her to go to the football field is between 8pm to 9pm. Therefore, the correct option is (D) 8pm to 9pm."
"Today, Elizabeth went to the park. Between what times could they have gone?
We know that:
Elizabeth woke up at 10am.
Emily saw Elizabeth buying a bike at the bike shop from 10am to 11am.
Leslie saw Elizabeth buying lunch at the deli from 11am to 2pm.
Sarah saw Elizabeth playing tennis at the tennis court from 4pm to 8pm.
The park was closed after 8pm.
Between what times could Elizabeth have gone to the park?
Options:
(A) 10am to 11am
(B) 11am to 2pm
(C) 4pm to 8pm
(D) 2pm to 4pm",(D),"We can eliminate options (A) and (D) because Elizabeth was either buying a bike or buying lunch during those times.   Therefore, Elizabeth could have gone to the park between 11am to 2pm when she was buying lunch at the deli, or between 4pm to 8pm when she was playing tennis at the tennis court.   Thus, the answer is either (B) or (C)."
"Today, James went to the swimming pool. Between what times could they have gone?
We know that:
James woke up at 10am.
Richard saw James taking photos near the Eiffel Tower from 10am to 11am.
Leslie saw James waiting at the airport from 12pm to 2pm.
Ashley saw James sitting on a rooftop from 2pm to 5pm.
Thomas saw James playing tennis at the tennis court from 5pm to 6pm.
Jennifer saw James walking towards the Statue of Liberty from 6pm to 7pm.
The swimming pool was closed after 7pm.
Between what times could James have gone to the swimming pool?
Options:
(A) 10am to 11am
(B) 12pm to 2pm
(C) 11am to 12pm
(D) 2pm to 5pm",(C),"From the given information, we can see that James was occupied from 10am to 11am, and from 12pm to 7pm. Therefore, the possible time period for James to visit the swimming pool would be between 11am to 12pm or between 5pm to 6pm. So, the correct option is (C) 11am to 12pm."
"Today, Michael went to the clothing store. Between what times could they have gone?
We know that:
Michael woke up at 5am.
Andrew saw Michael waiting at the train station from 6am to 1pm.
Sarah saw Michael walking towards the Statue of Liberty from 1pm to 3pm.
Mary saw Michael walking in the garden from 3pm to 6pm.
Lisa saw Michael taking photos near the Eiffel Tower from 6pm to 9pm.
Elizabeth saw Michael fixing their computer at the electronic store from 9pm to 10pm.
The clothing store was closed after 10pm.
Between what times could Michael have gone to the clothing store?
Options:
(A) 1pm to 3pm
(B) 9pm to 10pm
(C) 6am to 1pm
(D) 5am to 6am",(D),"Michael could have gone to the clothing store between 6am to 1pm or between 3pm to 6pm. The store may have been open between these times. Therefore, the option (C) is correct."
"Today, Sarah went to the amusement park. Between what times could they have gone?
We know that:
Sarah woke up at 10am.
Anthony saw Sarah getting a coffee at the cafe from 11am to 12pm.
Andrew saw Sarah buying a phone at the electronics store from 12pm to 2pm.
Kimberly saw Sarah driving to the water park from 2pm to 7pm.
Sarah saw Sarah attending class at the school from 7pm to 8pm.
Jennifer saw Sarah watching a movie at the theater from 8pm to 10pm.
The amusement park was closed after 10pm.
Between what times could Sarah have gone to the amusement park?
Options:
(A) 2pm to 7pm
(B) 12pm to 2pm
(C) 10am to 11am
(D) 7pm to 8pm",(C),"Based on the given information, Sarah was busy with other activities between 10am and 11am (getting coffee), 11am and 12pm (buying a phone), 2pm and 7pm (driving to the water park), and 8pm and 10pm (watching a movie). This means the only possible time she could have gone to the amusement park was between 12pm and 2pm (while Andrew saw her buying a phone) or between 7pm and 8pm (when Sarah saw herself attending class). Therefore, the answer is (B) 12pm to 2pm or (D) 7pm to 8pm."
"Today, Mark went to the art show. Between what times could they have gone?
We know that:
Mark woke up at 10am.
Betty saw Mark buying a bike at the bike shop from 10am to 11am.
Ashley saw Mark watching a movie at the theater from 1pm to 2pm.
Linda saw Mark working out at the gym from 2pm to 4pm.
Leslie saw Mark buying a phone at the electronics store from 4pm to 9pm.
Michael saw Mark waiting at the airport from 9pm to 10pm.
The art show was closed after 10pm.
Between what times could Mark have gone to the art show?
Options:
(A) 11am to 1pm
(B) 4pm to 9pm
(C) 10am to 11am
(D) 2pm to 4pm",(A),"Mark could have gone to the art show between 11am to 1pm, or after 10pm because the art show was closed after 10pm. Therefore the answer is option (A) 11am to 1pm."
"Today, Sean went to the swimming pool. Between what times could they have gone?
We know that:
Sean woke up at 6am.
Anthony saw Sean buying cookies at a bakery from 7am to 8am.
Mark saw Sean working out at the gym from 8am to 3pm.
Leslie saw Sean taking photos near the Leaning Tower of Pisa from 3pm to 5pm.
Emily saw Sean walking in the garden from 5pm to 6pm.
William saw Sean fixing their computer at the electronic store from 6pm to 7pm.
The swimming pool was closed after 7pm.
Between what times could Sean have gone to the swimming pool?
Options:
(A) 6am to 7am
(B) 3pm to 5pm
(C) 7am to 8am
(D) 6pm to 7pm",(A),"Based on the given information, the only window of time where Sean could have gone to the swimming pool is between 6am to 7am, before Anthony saw him at the bakery. Therefore, the answer is option (A) 6am to 7am."
"Today, James went to the swimming pool. Between what times could they have gone?
We know that:
James woke up at 5am.
Ashley saw James sitting on a rooftop from 7am to 9am.
Hannah saw James taking photos near the Eiffel Tower from 9am to 7pm.
William saw James buying cookies at a bakery from 7pm to 8pm.
Linda saw James waiting at the train station from 8pm to 10pm.
The swimming pool was closed after 10pm.
Between what times could James have gone to the swimming pool?
Options:
(A) 7pm to 8pm
(B) 8pm to 10pm
(C) 5am to 7am
(D) 7am to 9am",(C),"From the given information, we can see that James was busy from 5am to 7pm taking photos near the Eiffel Tower, and then buying cookies at a bakery from 7pm to 8pm. After that, Linda saw James waiting at the train station from 8pm to 10pm. So, the only time James could have gone to the swimming pool is between 5am to 7am or between 7am to 9am. Therefore, the answer is option (C) 5am to 7am or option (D) 7am to 9am."
"Today, Jessica went to the swimming pool. Between what times could they have gone?
We know that:
Jessica woke up at 9am.
Richard saw Jessica taking photos near the Leaning Tower of Pisa from 9am to 11am.
Mary saw Jessica reading at the library from 11am to 3pm.
Kimberly saw Jessica sitting on a rooftop from 3pm to 4pm.
The swimming pool was closed after 7pm.
Between what times could Jessica have gone to the swimming pool?
Options:
(A) 9am to 11am
(B) 3pm to 4pm
(C) 11am to 3pm
(D) 4pm to 7pm",(D),"From the given information, we can determine that Jessica was occupied from 9am to 11am, then from 11am to 3pm, and then from 3pm to 4pm. This means that the only possible time for Jessica to go to the swimming pool would be after 4pm and before it closed at 7pm.   Therefore, the answer is (D) 4pm to 7pm."
