"Today, Jessica went to the restaurant. Between what times could they have gone?
We know that:
Jessica woke up at 9am.
Nancy saw Jessica attending class at the school from 9am to 11am.
John saw Jessica taking photos near the Leaning Tower of Pisa from 11am to 12pm.
Mary saw Jessica taking photos near the Eiffel Tower from 12pm to 1pm.
Anthony saw Jessica buying a phone at the electronics store from 1pm to 4pm.
Kimberly saw Jessica buying cookies at a bakery from 4pm to 5pm.
The restaurant was closed after 6pm.
Between what times could Jessica have gone to the restaurant?
Options:
(A) 9am to 11am
(B) 4pm to 5pm
(C) 5pm to 6pm
(D) 11am to 12pm",(C),"Based on the given information, Jessica was busy with various activities from 9am to 1pm and from 1pm to 5pm. The only free time slot she had was between 5pm and 6pm, which is option (C). Therefore, Jessica could have gone to the restaurant between 5pm and 6pm."
"Today, David went to the construction site. Between what times could they have gone?
We know that:
David woke up at 7am.
Michael saw David reading at the library from 7am to 9am.
William saw David waiting at the airport from 6pm to 8pm.
Lisa saw David waiting at the train station from 8pm to 10pm.
The construction site was closed after 10pm.
Between what times could David have gone to the construction site?
Options:
(A) 7am to 9am
(B) 9am to 6pm
(C) 8pm to 10pm
(D) 6pm to 8pm",(B),"From the given information, we can see that David was seen at different places during specific time intervals. The only time interval left where David wasn't seen by anyone is between 9am to 6pm. Therefore, David could have gone to the construction site between 9am to 6pm.  Hence, the answer is (B) 9am to 6pm."
"Today, Jessica went to the bookstore. Between what times could they have gone?
We know that:
Jessica woke up at 6am.
Susan saw Jessica working out at the gym from 8am to 9am.
Andrew saw Jessica driving to the water park from 9am to 10am.
David saw Jessica walking towards the Statue of Liberty from 10am to 1pm.
Linda saw Jessica buying lunch at the deli from 1pm to 8pm.
James saw Jessica taking photos near the Eiffel Tower from 8pm to 9pm.
The bookstore was closed after 9pm.
Between what times could Jessica have gone to the bookstore?
Options:
(A) 9am to 10am
(B) 6am to 8am
(C) 8pm to 9pm
(D) 8am to 9am",(B),"Based on the given information, Jessica could have gone to the bookstore between 10am to 1pm, after David saw her walking towards the Statue of Liberty, and before Linda saw her buying lunch at the deli at 1pm. Therefore, the answer is not any of the options provided."
"Today, Mary went to the dance studio. Between what times could they have gone?
We know that:
Mary woke up at 9am.
Sarah saw Mary getting a coffee at the cafe from 9am to 10am.
Mary saw Mary walking in the garden from 12pm to 1pm.
Tiffany saw Mary driving to the water park from 1pm to 10pm.
The dance studio was closed after 10pm.
Between what times could Mary have gone to the dance studio?
Options:
(A) 12pm to 1pm
(B) 9am to 10am
(C) 1pm to 10pm
(D) 10am to 12pm",(D),"Mary could have gone to the dance studio between 10am to 12pm, as it is the only time slot that is not accounted for in the given information. Therefore, the answer is option (D) 10am to 12pm."
"Today, Michael went to the park. Between what times could they have gone?
We know that:
Michael woke up at 7am.
William saw Michael playing tennis at the tennis court from 7am to 8am.
Richard saw Michael working at the office from 1pm to 3pm.
Emily saw Michael buying lunch at the deli from 3pm to 8pm.
Mark saw Michael walking towards the Statue of Liberty from 8pm to 10pm.
The park was closed after 10pm.
Between what times could Michael have gone to the park?
Options:
(A) 3pm to 8pm
(B) 8am to 1pm
(C) 7am to 8am
(D) 8pm to 10pm",(B),"Based on the given information, the only time period where Michael could have gone to the park is from 8pm to 10pm, as Mark saw him walking towards the Statue of Liberty during that time and the park was closed after 10pm. Therefore, the answer is option (D) 8pm to 10pm."
"Today, David went to the clothing store. Between what times could they have gone?
We know that:
David woke up at 5am.
William saw David fixing their computer at the electronic store from 5am to 6am.
David saw David buying a bike at the bike shop from 6am to 9am.
John saw David waiting at the train station from 9am to 10am.
The clothing store was closed after 3pm.
Between what times could David have gone to the clothing store?
Options:
(A) 9am to 10am
(B) 6am to 9am
(C) 5am to 6am
(D) 10am to 3pm",(D),"From the given information, David was at the bike shop between 6am and 9am and at the train station between 9am and 10am. The clothing store was closed after 3pm, so David could have only gone to the clothing store between 10am and 3pm. Therefore, the answer is option (D) 10am to 3pm."
"Today, Andrew went to the museum. Between what times could they have gone?
We know that:
Andrew woke up at 5am.
James saw Andrew walking in the garden from 5am to 6am.
Ashley saw Andrew getting a coffee at the cafe from 6am to 8am.
David saw Andrew sitting on a rooftop from 8am to 10am.
Betty saw Andrew buying lunch at the deli from 10am to 11am.
Thomas saw Andrew fixing their computer at the electronic store from 8pm to 10pm.
The museum was closed after 10pm.
Between what times could Andrew have gone to the museum?
Options:
(A) 8am to 10am
(B) 5am to 6am
(C) 6am to 8am
(D) 11am to 8pm",(D),"Based on the given information, it can be concluded that Andrew was occupied from 11am to 8pm and the museum was closed after 10pm. The only time frame available for Andrew to visit the museum is between 5am to 6am or 6am to 8am. So the answer is either (B) 5am to 6am or (C) 6am to 8am."
"Today, Leslie went to the beach. Between what times could they have gone?
We know that:
Leslie woke up at 5am.
Emily saw Leslie attending class at the school from 5am to 9am.
Anthony saw Leslie watching a movie at the theater from 9am to 11am.
Thomas saw Leslie buying cookies at a bakery from 11am to 4pm.
Ashley saw Leslie fixing their computer at the electronic store from 4pm to 5pm.
Susan saw Leslie walking towards the Statue of Liberty from 9pm to 10pm.
The beach was closed after 10pm.
Between what times could Leslie have gone to the beach?
Options:
(A) 5pm to 9pm
(B) 9am to 11am
(C) 9pm to 10pm
(D) 4pm to 5pm",(A),"Based on the information given, the only time frame where Leslie was not seen doing something else is between 11am and 4pm when they were buying cookies. Therefore, Leslie could have gone to the beach between 11am and 4pm. The answer is not listed in the given options, but the correct time frame is between (D) 4pm to 5pm when Leslie was seen fixing a computer at the electronic store right before Susan saw them walking towards the Statue of Liberty."
"Today, Mary went to the amusement park. Between what times could they have gone?
We know that:
Mary woke up at 1pm.
Richard saw Mary stretching at a yoga studio from 1pm to 3pm.
Jessica saw Mary taking photos near the Leaning Tower of Pisa from 3pm to 4pm.
Samantha saw Mary fixing their computer at the electronic store from 4pm to 6pm.
Sean saw Mary getting a coffee at the cafe from 6pm to 7pm.
Kimberly saw Mary working at the office from 9pm to 10pm.
The amusement park was closed after 10pm.
Between what times could Mary have gone to the amusement park?
Options:
(A) 9pm to 10pm
(B) 1pm to 3pm
(C) 3pm to 4pm
(D) 7pm to 9pm",(D),"From the given information, we can see that Mary was occupied from 1pm to 10pm, except for the time between 7pm to 9pm. Therefore, Mary could have gone to the amusement park between 7pm to 9pm.  Hence, the answer is option (D) 7pm to 9pm."
"Today, Ashley went to the beach. Between what times could they have gone?
We know that:
Ashley woke up at 5am.
Mark saw Ashley buying cookies at a bakery from 5am to 7am.
Richard saw Ashley sitting on a rooftop from 9am to 1pm.
William saw Ashley walking in the garden from 1pm to 3pm.
Hannah saw Ashley taking photos near the Leaning Tower of Pisa from 3pm to 8pm.
Sarah saw Ashley getting a coffee at the cafe from 8pm to 9pm.
The beach was closed after 9pm.
Between what times could Ashley have gone to the beach?
Options:
(A) 5am to 7am
(B) 3pm to 8pm
(C) 9am to 1pm
(D) 7am to 9am",(D),"The possible time range for Ashley to have gone to the beach would be between 1pm to 3pm, before William saw her walking in the garden, and before the beach closed at 9pm. Therefore, the option is (B) 3pm to 8pm."
"Today, Samantha went to the market. Between what times could they have gone?
We know that:
Samantha woke up at 5am.
Sarah saw Samantha working at the office from 5am to 11am.
Ashley saw Samantha buying a phone at the electronics store from 11am to 1pm.
Leslie saw Samantha fixing their computer at the electronic store from 5pm to 8pm.
The market was closed after 8pm.
Between what times could Samantha have gone to the market?
Options:
(A) 5am to 11am
(B) 5pm to 8pm
(C) 11am to 1pm
(D) 1pm to 5pm",(D),"Based on the given information, Samantha was at the electronics store from 11am to 1pm and from 5pm to 8pm. Therefore, she could have gone to the market between 5am to 11am or between 1pm to 5pm. Thus, the options (A) and (D) are possible."
"Today, Elizabeth went to the gas station. Between what times could they have gone?
We know that:
Elizabeth woke up at 5am.
Mark saw Elizabeth buying a bike at the bike shop from 6am to 9am.
Andrew saw Elizabeth waiting at the airport from 9am to 10am.
Susan saw Elizabeth driving to the water park from 10am to 1pm.
Leslie saw Elizabeth waiting at the train station from 1pm to 2pm.
Thomas saw Elizabeth attending class at the school from 2pm to 6pm.
The gas station was closed after 6pm.
Between what times could Elizabeth have gone to the gas station?
Options:
(A) 5am to 6am
(B) 2pm to 6pm
(C) 1pm to 2pm
(D) 6am to 9am",(A),"From the given information, we can see that Elizabeth went to various places throughout the day and the gas station was closed after 6pm. Therefore, we can eliminate the options (B) and (D) as they are after 6pm.  We also know that Elizabeth was waiting at the train station from 1pm to 2pm (option C). Since the gas station was closed after 6pm, Elizabeth must have gone to the gas station before 1pm or between 2pm to 6pm. This leaves us with the options (A) 5am to 6am and (C) 1pm to 2pm. However, we know that Mark saw Elizabeth buying a bike at the bike shop from 6am to 9am, so Elizabeth could not have gone to the gas station between 5am to 6am. Therefore, the answer is option (C) 1pm to 2pm."
"Today, Sean went to the soccer field. Between what times could they have gone?
We know that:
Sean woke up at 5am.
Mary saw Sean walking towards the Statue of Liberty from 7am to 1pm.
Anthony saw Sean fixing their computer at the electronic store from 1pm to 4pm.
William saw Sean watching a movie at the theater from 4pm to 5pm.
Sarah saw Sean getting a coffee at the cafe from 5pm to 8pm.
The soccer field was closed after 8pm.
Between what times could Sean have gone to the soccer field?
Options:
(A) 1pm to 4pm
(B) 4pm to 5pm
(C) 5pm to 8pm
(D) 5am to 7am",(D),"Based on the given information, Sean could have gone to the soccer field between 7am to 1pm or after 8pm. The only option that includes a time after 8pm is (C) 5pm to 8pm, so that would be the answer."
"Today, Elizabeth went to the swimming pool. Between what times could they have gone?
We know that:
Elizabeth woke up at 6am.
Nancy saw Elizabeth fixing their computer at the electronic store from 6am to 7am.
Jessica saw Elizabeth attending class at the school from 7am to 11am.
William saw Elizabeth getting a coffee at the cafe from 11am to 3pm.
Betty saw Elizabeth taking photos near the Eiffel Tower from 3pm to 6pm.
The swimming pool was closed after 7pm.
Between what times could Elizabeth have gone to the swimming pool?
Options:
(A) 11am to 3pm
(B) 6am to 7am
(C) 6pm to 7pm
(D) 7am to 11am",(C),"From the given information, it can be seen that Elizabeth was occupied until 6pm in the evening. Therefore, she could have gone to the swimming pool between 6pm to 7pm before it got closed. So the correct option is (C) 6pm to 7pm."
"Today, Michael went to the clothing store. Between what times could they have gone?
We know that:
Michael woke up at 10am.
Sean saw Michael watching a movie at the theater from 10am to 12pm.
Sarah saw Michael buying a phone at the electronics store from 4pm to 6pm.
Mary saw Michael buying a bike at the bike shop from 6pm to 8pm.
The clothing store was closed after 8pm.
Between what times could Michael have gone to the clothing store?
Options:
(A) 6pm to 8pm
(B) 4pm to 6pm
(C) 10am to 12pm
(D) 12pm to 4pm",(D),"Michael could have gone to the clothing store between 12pm to 4pm because he was not seen by anyone during this time period and the store was not closed yet. So, the answer is (D) 12pm to 4pm."
"Today, Andrew went to the construction site. Between what times could they have gone?
We know that:
Andrew woke up at 9am.
Anthony saw Andrew buying clothes at the mall from 9am to 2pm.
Mark saw Andrew taking photos near the Leaning Tower of Pisa from 2pm to 3pm.
Tiffany saw Andrew sitting on a rooftop from 4pm to 7pm.
Samantha saw Andrew waiting at the train station from 7pm to 9pm.
The construction site was closed after 9pm.
Between what times could Andrew have gone to the construction site?
Options:
(A) 3pm to 4pm
(B) 4pm to 7pm
(C) 2pm to 3pm
(D) 7pm to 9pm",(A),"The only time period that overlaps with the construction site's open hours is from 3pm to 4pm, so the answer is option (A) 3pm to 4pm."
"Today, Nancy went to the soccer field. Between what times could they have gone?
We know that:
Nancy woke up at 5am.
William saw Nancy attending class at the school from 5am to 11am.
Leslie saw Nancy waiting at the train station from 11am to 12pm.
Nancy saw Nancy reading at the library from 3pm to 8pm.
The soccer field was closed after 8pm.
Between what times could Nancy have gone to the soccer field?
Options:
(A) 3pm to 8pm
(B) 12pm to 3pm
(C) 5am to 11am
(D) 11am to 12pm",(B),"Based on the information provided, we know that Nancy was occupied at the following times: - 5am to 11am (attending class at school) - 11am to 12pm (waiting at train station) - 3pm to 8pm (reading at the library)  Therefore, the only possible time for Nancy to go to the soccer field would be between 12pm to 3pm. Therefore, the answer is (B) 12pm to 3pm."
"Today, Jason went to the museum. Between what times could they have gone?
We know that:
Jason woke up at 7am.
Jessica saw Jason taking photos near the Eiffel Tower from 7am to 8am.
Andrew saw Jason working at the office from 9am to 5pm.
Susan saw Jason buying a phone at the electronics store from 5pm to 8pm.
John saw Jason attending class at the school from 8pm to 9pm.
The museum was closed after 9pm.
Between what times could Jason have gone to the museum?
Options:
(A) 7am to 8am
(B) 9am to 5pm
(C) 5pm to 8pm
(D) 8am to 9am",(D),"We can see from the given information that Jason was busy with other activities during the following times: - From 7am to 8am, he was taking photos near the Eiffel Tower. - From 9am to 5pm, he was working at the office. - From 5pm to 8pm, he was buying a phone at the electronics store. - From 8pm to 9pm, he was attending class at the school. Therefore, Jason could have gone to the museum between 8pm and 9pm, as the museum was closed after 9pm. The answer is (D) 8am to 9am is incorrect because Jason was seen taking photos near the Eiffel Tower during that time."
"Today, Anthony went to the gas station. Between what times could they have gone?
We know that:
Anthony woke up at 5am.
Susan saw Anthony reading at the library from 5am to 7am.
Sarah saw Anthony walking towards the Statue of Liberty from 7am to 10am.
Nancy saw Anthony working out at the gym from 5pm to 7pm.
David saw Anthony driving to the water park from 7pm to 8pm.
The gas station was closed after 8pm.
Between what times could Anthony have gone to the gas station?
Options:
(A) 7pm to 8pm
(B) 10am to 5pm
(C) 5pm to 7pm
(D) 5am to 7am",(B),"Based on the given information, we can see that Anthony was busy from 5am to 7am at the library and from 7am to 10am at the Statue of Liberty. He also went to the gym from 5pm to 7pm and then drove to the water park from 7pm to 8pm. The gas station was closed after 8pm, so he couldn't have gone after that time. Therefore, the only possible time he could have gone to the gas station is between 10am to 5pm. Hence, the answer is (B) 10am to 5pm."
"Today, Leslie went to the movies. Between what times could they have gone?
We know that:
Leslie woke up at 6am.
Susan saw Leslie sitting on a rooftop from 6am to 7am.
Mary saw Leslie working at the office from 12pm to 2pm.
Steven saw Leslie getting a coffee at the cafe from 2pm to 7pm.
The movies was closed after 7pm.
Between what times could Leslie have gone to the movies?
Options:
(A) 7am to 12pm
(B) 2pm to 7pm
(C) 12pm to 2pm
(D) 6am to 7am",(A),"Leslie was seen by Susan from 6am to 7am, and by Mary from 12pm to 2pm. This means Leslie could have gone to the movies between 7am and 12pm, or between 2pm and 7pm when she was seen by Steven. However, the movies is closed after 7pm, which means Leslie could not have gone to the movies after that time.   Therefore, the possible time ranges for Leslie to have gone to the movies are:  (A) 7am to 12pm  or  (B) 2pm to 7pm  So either option A or B could be the correct answer."
"Today, David went to the clothing store. Between what times could they have gone?
We know that:
David woke up at 6am.
Sarah saw David walking towards the Statue of Liberty from 8am to 9am.
Leslie saw David watching a movie at the theater from 9am to 11am.
Emily saw David buying clothes at the mall from 11am to 1pm.
Hannah saw David walking in the garden from 1pm to 3pm.
Samantha saw David reading at the library from 3pm to 4pm.
The clothing store was closed after 4pm.
Between what times could David have gone to the clothing store?
Options:
(A) 11am to 1pm
(B) 8am to 9am
(C) 6am to 8am
(D) 1pm to 3pm",(C),"We can eliminate options (B) and (C) because David was seen by other people during those times. David was seen buying clothes at the mall from 11am to 1pm, so option (A) is the correct answer. Option (D) can also be eliminated because Hannah saw David walking in the garden from 1pm to 3pm."
"Today, Hannah went to the basketball court. Between what times could they have gone?
We know that:
Hannah woke up at 6am.
James saw Hannah playing tennis at the tennis court from 6am to 10am.
Anthony saw Hannah walking in the garden from 10am to 11am.
Jennifer saw Hannah waiting at the train station from 11am to 3pm.
Linda saw Hannah stretching at a yoga studio from 5pm to 8pm.
Kimberly saw Hannah reading at the library from 8pm to 10pm.
The basketball court was closed after 10pm.
Between what times could Hannah have gone to the basketball court?
Options:
(A) 11am to 3pm
(B) 10am to 11am
(C) 8pm to 10pm
(D) 3pm to 5pm",(D),"Based on the information provided, Hannah could have gone to the basketball court between 6am to 10am or 5pm to 8pm. So, the correct option would be (C) 8pm to 10pm as the basketball court was closed after 10pm."
"Today, Sarah went to the market. Between what times could they have gone?
We know that:
Sarah woke up at 6am.
James saw Sarah taking photos near the Eiffel Tower from 6am to 10am.
Betty saw Sarah buying cookies at a bakery from 10am to 12pm.
William saw Sarah walking in the garden from 12pm to 1pm.
John saw Sarah working at the office from 1pm to 2pm.
Steven saw Sarah driving to the water park from 6pm to 7pm.
The market was closed after 7pm.
Between what times could Sarah have gone to the market?
Options:
(A) 6pm to 7pm
(B) 1pm to 2pm
(C) 10am to 12pm
(D) 2pm to 6pm",(D),"Sarah could have gone to the market between 2pm to 6pm because these are the only hours during the day where there are no reported sightings of Sarah. The given options are not relevant since none of them include this time range. Therefore, the answer is (D) 2pm to 6pm."
"Today, Andrew went to the park. Between what times could they have gone?
We know that:
Andrew woke up at 5am.
Tiffany saw Andrew reading at the library from 6am to 10am.
Nancy saw Andrew walking in the garden from 10am to 12pm.
Sarah saw Andrew working out at the gym from 12pm to 5pm.
Emily saw Andrew waiting at the airport from 5pm to 9pm.
The park was closed after 9pm.
Between what times could Andrew have gone to the park?
Options:
(A) 12pm to 5pm
(B) 5pm to 9pm
(C) 6am to 10am
(D) 5am to 6am",(D),"Andrew could have gone to the park between 10am to 12pm or after 5pm, since those are the only times when he was not seen. So the options are (B) 5pm to 9pm or none of the above."
"Today, William went to the art studio. Between what times could they have gone?
We know that:
William woke up at 6am.
Betty saw William reading at the library from 12pm to 3pm.
Hannah saw William fixing their computer at the electronic store from 3pm to 4pm.
Nancy saw William buying cookies at a bakery from 4pm to 7pm.
Sarah saw William walking towards the Statue of Liberty from 7pm to 8pm.
Michael saw William watching a movie at the theater from 8pm to 10pm.
The art studio was closed after 10pm.
Between what times could William have gone to the art studio?
Options:
(A) 7pm to 8pm
(B) 6am to 12pm
(C) 8pm to 10pm
(D) 12pm to 3pm",(B),"Based on the given timeline, William could have gone to the art studio between 4pm to 7pm or after 10pm because the art studio was closed after 10pm. Therefore, the correct option would be (C) 8pm to 10pm."
"Today, Elizabeth went to the bakery. Between what times could they have gone?
We know that:
Elizabeth woke up at 8am.
David saw Elizabeth attending class at the school from 8am to 4pm.
Elizabeth saw Elizabeth fixing their computer at the electronic store from 4pm to 5pm.
Ashley saw Elizabeth getting a coffee at the cafe from 5pm to 9pm.
The bakery was closed after 10pm.
Between what times could Elizabeth have gone to the bakery?
Options:
(A) 8am to 4pm
(B) 9pm to 10pm
(C) 4pm to 5pm
(D) 5pm to 9pm",(B),"Based on the given information, Elizabeth could have gone to the bakery between 5pm to 9pm, as during that time she was seen getting coffee at the cafe which falls within that time range and the bakery was not closed at that time. So, the answer is (D) 5pm to 9pm."
"Today, Sarah went to the soccer field. Between what times could they have gone?
We know that:
Sarah woke up at 5am.
Thomas saw Sarah sitting on a rooftop from 11am to 3pm.
Andrew saw Sarah fixing their computer at the electronic store from 3pm to 5pm.
Emily saw Sarah waiting at the airport from 5pm to 9pm.
The soccer field was closed after 9pm.
Between what times could Sarah have gone to the soccer field?
Options:
(A) 3pm to 5pm
(B) 11am to 3pm
(C) 5am to 11am
(D) 5pm to 9pm",(C),"We can eliminate option D since Sarah was seen waiting at the airport from 5pm to 9pm. The soccer field was closed after 9pm so she couldn't have gone after that time.   Similarly, we can eliminate option C as Sarah waking up at 5am was the earliest time mentioned and there's no indication that she went to the soccer field before that.   That leaves us with options A and B. Sarah was seen sitting on a rooftop from 11am to 3pm and then fixing a computer at the electronic store from 3pm to 5pm. We don't know for sure if she went to the soccer field during this time, but it's possible.   However, since option B includes the time slot of 11am to 3pm, which is when Sarah was seen sitting on the rooftop, we can eliminate option B.   Therefore, the answer is (A) 3pm to 5pm."
"Today, David went to the art show. Between what times could they have gone?
We know that:
David woke up at 5am.
Samantha saw David working at the office from 5am to 7am.
Mary saw David taking photos near the Eiffel Tower from 7am to 1pm.
Leslie saw David driving to the water park from 3pm to 8pm.
The art show was closed after 8pm.
Between what times could David have gone to the art show?
Options:
(A) 7am to 1pm
(B) 3pm to 8pm
(C) 5am to 7am
(D) 1pm to 3pm",(D),"We can eliminate options (B) and (D) because David was either at the office or driving to the water park during those times.   Option (C) can also be eliminated because the art show would not have been open at that time.   Therefore, the only possible option is (A) from 7am to 1pm, after David was finished taking photos and before Leslie saw him driving to the water park."
"Today, Jason went to the park. Between what times could they have gone?
We know that:
Jason woke up at 5am.
Nancy saw Jason buying clothes at the mall from 5am to 2pm.
Emily saw Jason walking in the garden from 2pm to 4pm.
John saw Jason reading at the library from 5pm to 8pm.
Jennifer saw Jason buying lunch at the deli from 8pm to 9pm.
The park was closed after 9pm.
Between what times could Jason have gone to the park?
Options:
(A) 5am to 2pm
(B) 4pm to 5pm
(C) 2pm to 4pm
(D) 8pm to 9pm",(B),"Based on the given information, Jason could have gone to the park between 5am to 2pm or from 4pm to 5pm.   We know that Jason was busy from 2pm to 4pm, reading at the library from 5pm to 8pm, and buying lunch at the deli from 8pm to 9pm. Additionally, we know that the park was closed after 9pm. Therefore, the only time frames possible are before 2pm or between 4pm-5pm.   So, the answer options are (A) 5am to 2pm and (B) 4pm to 5pm."
