"Today, Jason went to the gas station. Between what times could they have gone?
We know that:
Jason woke up at 5am.
Sean saw Jason walking in the garden from 5am to 8am.
David saw Jason buying lunch at the deli from 8am to 2pm.
Jennifer saw Jason driving to the water park from 2pm to 5pm.
Lisa saw Jason watching a movie at the theater from 6pm to 7pm.
Mary saw Jason buying cookies at a bakery from 7pm to 10pm.
The gas station was closed after 10pm.
Between what times could Jason have gone to the gas station?
Options:
(A) 5pm to 6pm
(B) 2pm to 5pm
(C) 6pm to 7pm
(D) 8am to 2pm",(A),"From the given information, we can see that Jason had the chance to visit the gas station before 8 am or after 7 pm. None of the given options fall within that range. Therefore, none of the given options is correct."
"Today, Sean went to the restaurant. Between what times could they have gone?
We know that:
Sean woke up at 5am.
Emily saw Sean sitting on a rooftop from 5am to 6am.
Jason saw Sean fixing their computer at the electronic store from 6am to 7am.
Jennifer saw Sean working out at the gym from 7am to 8am.
David saw Sean taking photos near the Leaning Tower of Pisa from 9am to 7pm.
The restaurant was closed after 7pm.
Between what times could Sean have gone to the restaurant?
Options:
(A) 7am to 8am
(B) 6am to 7am
(C) 9am to 7pm
(D) 8am to 9am",(D),"Based on the given information, Sean could have gone to the restaurant between 8am and 9am, as there is no sighting of him during that hour and the restaurant was not closed yet. Therefore, the correct option is (D) 8am to 9am."
"Today, Sarah went to the gas station. Between what times could they have gone?
We know that:
Sarah woke up at 7am.
Kimberly saw Sarah sitting on a rooftop from 7am to 9am.
Mark saw Sarah buying a bike at the bike shop from 11am to 2pm.
John saw Sarah buying cookies at a bakery from 2pm to 3pm.
William saw Sarah fixing their computer at the electronic store from 3pm to 4pm.
The gas station was closed after 4pm.
Between what times could Sarah have gone to the gas station?
Options:
(A) 11am to 2pm
(B) 2pm to 3pm
(C) 9am to 11am
(D) 3pm to 4pm",(C),"Based on the given information, we can eliminate options (B) and (D) since Sarah was seen by John and William during those times. We can also eliminate option (C) since Sarah was seen by Kimberly between 7am to 9am. Therefore, the only option left is (A) 11am to 2pm, where Sarah was not seen by anyone during those hours and could have gone to the gas station."
"Today, Andrew went to the art show. Between what times could they have gone?
We know that:
Andrew woke up at 6am.
Kimberly saw Andrew waiting at the airport from 10am to 12pm.
Anthony saw Andrew attending class at the school from 12pm to 7pm.
John saw Andrew working out at the gym from 7pm to 8pm.
The art show was closed after 8pm.
Between what times could Andrew have gone to the art show?
Options:
(A) 6am to 10am
(B) 7pm to 8pm
(C) 12pm to 7pm
(D) 10am to 12pm",(A),"Based on the given information, Andrew could have gone to the art show between 8pm to 10pm, as the art show was closed after 8pm and John saw Andrew working out at the gym from 7pm to 8pm. Therefore, the answer is not one of the given options."
"Today, James went to the restaurant. Between what times could they have gone?
We know that:
James woke up at 12pm.
Elizabeth saw James stretching at a yoga studio from 3pm to 4pm.
Michael saw James fixing their computer at the electronic store from 4pm to 7pm.
Mary saw James working at the office from 7pm to 9pm.
Nancy saw James working out at the gym from 9pm to 10pm.
The restaurant was closed after 10pm.
Between what times could James have gone to the restaurant?
Options:
(A) 12pm to 3pm
(B) 3pm to 4pm
(C) 7pm to 9pm
(D) 9pm to 10pm",(A),"Based on the given information, James could have gone to the restaurant between 4pm and 7pm as there is no mention of his whereabouts during that time period. Therefore, the correct option is not given, it should be (E) 4pm to 7pm."
"Today, Ashley went to the construction site. Between what times could they have gone?
We know that:
Ashley woke up at 5am.
James saw Ashley working at the office from 5am to 9am.
Richard saw Ashley buying a phone at the electronics store from 4pm to 7pm.
David saw Ashley playing tennis at the tennis court from 7pm to 8pm.
William saw Ashley watching a movie at the theater from 8pm to 10pm.
The construction site was closed after 10pm.
Between what times could Ashley have gone to the construction site?
Options:
(A) 4pm to 7pm
(B) 5am to 9am
(C) 9am to 4pm
(D) 8pm to 10pm",(C),"Based on the given information, Ashley was occupied with other activities from 5am to 9am, and from 4pm to 10pm. Therefore, the only possible time she could have gone to the construction site is between 9am to 4pm. Hence, the answer is option (C)."
"Today, Ashley went to the gas station. Between what times could they have gone?
We know that:
Ashley woke up at 5am.
Nancy saw Ashley buying cookies at a bakery from 6am to 7am.
David saw Ashley working at the office from 7am to 1pm.
Tiffany saw Ashley buying a phone at the electronics store from 1pm to 3pm.
Mary saw Ashley getting a coffee at the cafe from 3pm to 4pm.
Lisa saw Ashley buying lunch at the deli from 4pm to 10pm.
The gas station was closed after 10pm.
Between what times could Ashley have gone to the gas station?
Options:
(A) 3pm to 4pm
(B) 6am to 7am
(C) 7am to 1pm
(D) 5am to 6am",(D),"Based on the given information, Ashley could have gone to the gas station between 4pm and 10pm, as Lisa saw Ashley buying lunch at the deli until 4pm and the gas station was closed after 10pm. Therefore, the correct answer is not listed among the options provided."
"Today, Sarah went to the clothing store. Between what times could they have gone?
We know that:
Sarah woke up at 5am.
Ashley saw Sarah taking photos near the Eiffel Tower from 5am to 11am.
Michael saw Sarah walking in the garden from 11am to 12pm.
Emily saw Sarah buying cookies at a bakery from 12pm to 2pm.
Richard saw Sarah buying a phone at the electronics store from 2pm to 3pm.
The clothing store was closed after 7pm.
Between what times could Sarah have gone to the clothing store?
Options:
(A) 3pm to 7pm
(B) 2pm to 3pm
(C) 12pm to 2pm
(D) 11am to 12pm",(A),"Based on the given information, we know that Sarah was at the electronics store from 2pm to 3pm. Therefore, the latest possible time she could have gone to the clothing store is 2pm. We also know that Sarah was seen buying cookies at a bakery from 12pm to 2pm, so she could have gone to the clothing store anytime between 12pm to 2pm. Therefore, the answer is (C) 12pm to 2pm."
"Today, Michael went to the football field. Between what times could they have gone?
We know that:
Michael woke up at 5am.
Kimberly saw Michael stretching at a yoga studio from 5am to 7am.
William saw Michael walking in the garden from 7am to 8am.
Sarah saw Michael fixing their computer at the electronic store from 8am to 10am.
Nancy saw Michael waiting at the airport from 10am to 12pm.
Samantha saw Michael working out at the gym from 1pm to 9pm.
The football field was closed after 9pm.
Between what times could Michael have gone to the football field?
Options:
(A) 12pm to 1pm
(B) 10am to 12pm
(C) 7am to 8am
(D) 5am to 7am",(A),"Since Michael arrived at the gym at 1pm and the football field was closed after 9pm, it means he had between 9 hours (from 10am to 7pm) to potentially go to the football field. The only time slot he was not accounted for was between 12pm and 1pm, so the answer is (A) 12pm to 1pm."
"Today, Anthony went to the basketball court. Between what times could they have gone?
We know that:
Anthony woke up at 5am.
Sarah saw Anthony buying clothes at the mall from 5am to 7am.
Tiffany saw Anthony buying lunch at the deli from 7am to 12pm.
Sean saw Anthony watching a movie at the theater from 12pm to 2pm.
Emily saw Anthony buying a phone at the electronics store from 2pm to 4pm.
The basketball court was closed after 9pm.
Between what times could Anthony have gone to the basketball court?
Options:
(A) 5am to 7am
(B) 12pm to 2pm
(C) 4pm to 9pm
(D) 7am to 12pm",(C),"Based on the given information, Anthony could have gone to the basketball court between 4pm to 9pm. We know Anthony was occupied with various activities from 5am to 4pm, and the basketball court was closed after 9pm. Therefore, option (C) is the correct answer."
"Today, William went to the restaurant. Between what times could they have gone?
We know that:
William woke up at 11am.
Nancy saw William buying clothes at the mall from 3pm to 5pm.
Leslie saw William buying a phone at the electronics store from 5pm to 7pm.
David saw William playing tennis at the tennis court from 7pm to 10pm.
The restaurant was closed after 10pm.
Between what times could William have gone to the restaurant?
Options:
(A) 3pm to 5pm
(B) 11am to 3pm
(C) 5pm to 7pm
(D) 7pm to 10pm",(B),"William could have gone to the restaurant between 5pm to 7pm, before he went to the tennis court to play tennis. The restaurant was closed after 10pm, and William did not have time to go to the restaurant before 3pm or after 10pm, as he was seen buying clothes and a phone during those times. Therefore, option (C) 5pm to 7pm is the correct answer."
"Today, Susan went to the soccer field. Between what times could they have gone?
We know that:
Susan woke up at 5am.
William saw Susan walking in the garden from 5am to 6am.
Anthony saw Susan working out at the gym from 6am to 7am.
Betty saw Susan fixing their computer at the electronic store from 2pm to 6pm.
Lisa saw Susan buying cookies at a bakery from 6pm to 8pm.
Linda saw Susan playing tennis at the tennis court from 8pm to 9pm.
The soccer field was closed after 9pm.
Between what times could Susan have gone to the soccer field?
Options:
(A) 6am to 7am
(B) 5am to 6am
(C) 7am to 2pm
(D) 6pm to 8pm",(C),"From the given information, Susan was busy from 5am to 6pm. After that, she played tennis from 8pm to 9pm, and the soccer field was closed after 9pm. So the only time Susan could have gone to the soccer field is between 7pm and 8pm, which is not given in the options. Therefore, the answer is none of the above options."
"Today, Sarah went to the dance studio. Between what times could they have gone?
We know that:
Sarah woke up at 5am.
Susan saw Sarah buying a phone at the electronics store from 5am to 7am.
Emily saw Sarah playing tennis at the tennis court from 7am to 11am.
Thomas saw Sarah sitting on a rooftop from 1pm to 6pm.
The dance studio was closed after 6pm.
Between what times could Sarah have gone to the dance studio?
Options:
(A) 1pm to 6pm
(B) 7am to 11am
(C) 5am to 7am
(D) 11am to 1pm",(D),"Based on the given information, Sarah could have gone to the dance studio between 11am to 1pm, before Thomas saw her sitting on the rooftop at 1pm. Therefore, the answer is (D) 11am to 1pm."
"Today, Emily went to the park. Between what times could they have gone?
We know that:
Emily woke up at 5am.
Leslie saw Emily getting a coffee at the cafe from 5am to 6am.
Kimberly saw Emily walking towards the Statue of Liberty from 6am to 2pm.
Richard saw Emily waiting at the airport from 4pm to 10pm.
The park was closed after 10pm.
Between what times could Emily have gone to the park?
Options:
(A) 6am to 2pm
(B) 4pm to 10pm
(C) 5am to 6am
(D) 2pm to 4pm",(D),"Based on the given information, Emily was at the Statue of Liberty from 6am to 2pm and at the airport from 4pm to 10pm. Therefore, the only possible time frame for Emily to have gone to the park is between 2pm and 4pm. The answer is (D) 2pm to 4pm."
"Today, Emily went to the basketball court. Between what times could they have gone?
We know that:
Emily woke up at 12pm.
John saw Emily playing tennis at the tennis court from 12pm to 2pm.
Sean saw Emily waiting at the airport from 2pm to 3pm.
Samantha saw Emily buying clothes at the mall from 6pm to 8pm.
Anthony saw Emily taking photos near the Leaning Tower of Pisa from 8pm to 9pm.
Sarah saw Emily working out at the gym from 9pm to 10pm.
The basketball court was closed after 10pm.
Between what times could Emily have gone to the basketball court?
Options:
(A) 3pm to 6pm
(B) 12pm to 2pm
(C) 6pm to 8pm
(D) 2pm to 3pm",(A),"From the given information, we know that Emily was occupied from 12pm to 2pm playing tennis with John and from 2pm to 3pm waiting at the airport with Sean. Therefore, she couldn't have gone to the basketball court during this time.   Similarly, Samantha saw Emily buying clothes from 6pm to 8pm and Anthony saw her taking photos from 8pm to 9pm, so she couldn't have gone to the basketball court during that time either.   Sarah saw Emily working out at the gym from 9pm to 10pm, and we also know that the basketball court was closed after 10pm. Therefore, Emily could have gone to the basketball court between 3pm to 6pm.   So, the answer is (A) 3pm to 6pm."
"Today, Sean went to the art show. Between what times could they have gone?
We know that:
Sean woke up at 7am.
Elizabeth saw Sean fixing their computer at the electronic store from 7am to 11am.
Anthony saw Sean waiting at the airport from 11am to 2pm.
Tiffany saw Sean waiting at the train station from 2pm to 3pm.
Andrew saw Sean buying a bike at the bike shop from 4pm to 8pm.
The art show was closed after 8pm.
Between what times could Sean have gone to the art show?
Options:
(A) 3pm to 4pm
(B) 7am to 11am
(C) 4pm to 8pm
(D) 11am to 2pm",(A),"Based on the given information, Sean was not available to go to the art show from 11am to 2pm (seen by Anthony) and from 4pm to 8pm (seen by Andrew). Therefore, Sean could have gone to the art show between 7am to 11am (seen by Elizabeth) or between 2pm to 3pm (seen by Tiffany).   So the answer is either (B) 7am to 11am or (A) 3pm to 4pm. However, since the art show was closed after 8pm, we can safely eliminate both of these options.   Therefore, it is not possible for us to determine between what times Sean could have gone to the art show with the given information."
"Today, Elizabeth went to the movies. Between what times could they have gone?
We know that:
Elizabeth woke up at 5am.
Sarah saw Elizabeth getting a coffee at the cafe from 5am to 3pm.
Susan saw Elizabeth working out at the gym from 3pm to 4pm.
John saw Elizabeth buying a phone at the electronics store from 4pm to 6pm.
Tiffany saw Elizabeth waiting at the train station from 6pm to 7pm.
Andrew saw Elizabeth waiting at the airport from 7pm to 8pm.
The movies was closed after 9pm.
Between what times could Elizabeth have gone to the movies?
Options:
(A) 8pm to 9pm
(B) 4pm to 6pm
(C) 5am to 3pm
(D) 6pm to 7pm",(A),"Based on the given information, Elizabeth was at the train station from 6pm to 7pm and at the airport from 7pm to 8pm. This means that the latest she could have gone to the movies would be at 8pm. Therefore, option (A) 8pm to 9pm is the correct answer."
"Today, William went to the basketball court. Between what times could they have gone?
We know that:
William woke up at 7am.
Lisa saw William stretching at a yoga studio from 11am to 2pm.
John saw William walking towards the Statue of Liberty from 2pm to 3pm.
Sean saw William reading at the library from 3pm to 5pm.
Sarah saw William driving to the water park from 5pm to 9pm.
The basketball court was closed after 9pm.
Between what times could William have gone to the basketball court?
Options:
(A) 5pm to 9pm
(B) 3pm to 5pm
(C) 7am to 11am
(D) 11am to 2pm",(C),"Based on the information provided, William could have gone to the basketball court before Lisa saw him at the yoga studio from 7am to 11am or after Sarah saw him driving to the water park from 9pm onwards. Therefore, the possible time frames when William could have gone to the basketball court are: 1. 7am to 11am 2. 3pm to 5pm (since Sean saw William at the library until 5pm) So, the answer is (B) 3pm to 5pm."
"Today, Thomas went to the market. Between what times could they have gone?
We know that:
Thomas woke up at 6am.
Andrew saw Thomas sitting on a rooftop from 6am to 7am.
Elizabeth saw Thomas taking photos near the Leaning Tower of Pisa from 9am to 10am.
Samantha saw Thomas waiting at the airport from 10am to 12pm.
Michael saw Thomas buying clothes at the mall from 12pm to 6pm.
Sarah saw Thomas walking towards the Statue of Liberty from 6pm to 7pm.
The market was closed after 7pm.
Between what times could Thomas have gone to the market?
Options:
(A) 12pm to 6pm
(B) 7am to 9am
(C) 6pm to 7pm
(D) 10am to 12pm",(B),"We can eliminate options (B) and (C) since Thomas was seen by Andrew at 6am and by Sarah at 7pm, indicating that he was not at the market during those times.   Similarly, Thomas was seen waiting at the airport from 10am to 12pm, meaning that he could not have been at the market during that time either.   This leaves us with option (A) - between 12pm to 6pm - as the only possible time for Thomas to have gone to the market. Therefore, option (A) is the correct answer."
"Today, Susan went to the museum. Between what times could they have gone?
We know that:
Susan woke up at 9am.
Thomas saw Susan waiting at the airport from 9am to 1pm.
David saw Susan working at the office from 4pm to 5pm.
Elizabeth saw Susan buying cookies at a bakery from 5pm to 6pm.
Kimberly saw Susan sitting on a rooftop from 6pm to 9pm.
The museum was closed after 9pm.
Between what times could Susan have gone to the museum?
Options:
(A) 5pm to 6pm
(B) 6pm to 9pm
(C) 4pm to 5pm
(D) 1pm to 4pm",(D),"Susan could have gone to the museum between 1pm to 4pm, before Thomas saw her at the airport. Therefore, the answer is (D)."
"Today, Kimberly went to the construction site. Between what times could they have gone?
We know that:
Kimberly woke up at 6am.
Hannah saw Kimberly buying cookies at a bakery from 7am to 8am.
Thomas saw Kimberly fixing their computer at the electronic store from 8am to 10am.
John saw Kimberly buying a phone at the electronics store from 10am to 11am.
David saw Kimberly playing tennis at the tennis court from 11am to 2pm.
Mark saw Kimberly watching a movie at the theater from 2pm to 3pm.
The construction site was closed after 3pm.
Between what times could Kimberly have gone to the construction site?
Options:
(A) 6am to 7am
(B) 8am to 10am
(C) 10am to 11am
(D) 11am to 2pm",(A),"From the given information, we know that Kimberly was at the electronics store from 8am to 11am (she was fixing her computer from 8am to 10am and buying a phone from 10am to 11am). Therefore, she could not have gone to the construction site during that time.   We also know that she was playing tennis at the tennis court from 11am to 2pm and watching a movie at the theater from 2pm to 3pm. Therefore, she could not have gone to the construction site during those times either.   The only remaining option is between 6am to 7am, before Hannah saw her buying cookies at the bakery. Therefore, option (A) 6am to 7am is the correct answer."
"Today, Leslie went to the soccer field. Between what times could they have gone?
We know that:
Leslie woke up at 5am.
Sarah saw Leslie waiting at the train station from 5am to 12pm.
Hannah saw Leslie sitting on a rooftop from 12pm to 2pm.
Elizabeth saw Leslie buying a bike at the bike shop from 3pm to 4pm.
Emily saw Leslie working at the office from 4pm to 10pm.
The soccer field was closed after 10pm.
Between what times could Leslie have gone to the soccer field?
Options:
(A) 12pm to 2pm
(B) 2pm to 3pm
(C) 4pm to 10pm
(D) 5am to 12pm",(B),"We can eliminate option (D) because Leslie was seen waiting at the train station during that time. We can eliminate option (C) because Leslie was seen working at the office during that time and the soccer field was closed after 10pm. Option (A) is a possibility since Leslie was seen sitting on a rooftop during that time, but we cannot confirm whether or not they went to the soccer field afterwards. Option (B) is not a possibility since no one saw Leslie during that time. Therefore, the answer is (A) 12pm to 2pm, but it is not a definitive answer."
"Today, William went to the amusement park. Between what times could they have gone?
We know that:
William woke up at 5am.
Betty saw William walking towards the Statue of Liberty from 5am to 9am.
David saw William reading at the library from 4pm to 7pm.
Lisa saw William taking photos near the Leaning Tower of Pisa from 7pm to 9pm.
The amusement park was closed after 9pm.
Between what times could William have gone to the amusement park?
Options:
(A) 9am to 4pm
(B) 5am to 9am
(C) 4pm to 7pm
(D) 7pm to 9pm",(A),"Based on the given information, William was occupied from 5am to 9am and from 4pm to 9pm. Therefore, William could have gone to the amusement park between 9am to 4pm.   So the correct option is (A) 9am to 4pm."
"Today, Andrew went to the clothing store. Between what times could they have gone?
We know that:
Andrew woke up at 9am.
David saw Andrew waiting at the train station from 9am to 12pm.
Emily saw Andrew walking towards the Statue of Liberty from 12pm to 4pm.
Sarah saw Andrew walking in the garden from 4pm to 8pm.
Nancy saw Andrew fixing their computer at the electronic store from 9pm to 10pm.
The clothing store was closed after 10pm.
Between what times could Andrew have gone to the clothing store?
Options:
(A) 9am to 12pm
(B) 9pm to 10pm
(C) 12pm to 4pm
(D) 8pm to 9pm",(D),"Based on the given information, Andrew could have gone to the clothing store between 4pm to 8pm when Sarah saw him walking in the garden and before 9pm when Nancy saw him fixing their computer at the electronic store. Therefore, the answer is (D) 8pm to 9pm."
"Today, Jennifer went to the coffee shop. Between what times could they have gone?
We know that:
Jennifer woke up at 5am.
Steven saw Jennifer stretching at a yoga studio from 5am to 8am.
Richard saw Jennifer waiting at the train station from 8am to 10am.
Mark saw Jennifer walking in the garden from 12pm to 7pm.
The coffee shop was closed after 7pm.
Between what times could Jennifer have gone to the coffee shop?
Options:
(A) 10am to 12pm
(B) 5am to 8am
(C) 8am to 10am
(D) 12pm to 7pm",(A),"From the given information, we can see that Jennifer was occupied from 5am to 10am (stretching from 5am to 8am + waiting at the train station from 8am to 10am). Therefore, she could have gone to the coffee shop in the time frame from 10am to 7pm.   Option (A) is between 10am to 12pm which is a potential time frame for Jennifer to have gone to the coffee shop.  Option (B) is between 5am to 8am which is when Jennifer was stretching, so it's not possible.  Option (C) is between 8am to 10am which is when Jennifer was waiting at the train station, so it's not possible.  Option (D) is between 12pm to 7pm which is a potential time frame for Jennifer to have gone to the coffee shop, but we need to select the earliest possible time frame, which is from 10am to 12pm.   Therefore, the answer is (A) 10am to 12pm."
"Today, Susan went to the art studio. Between what times could they have gone?
We know that:
Susan woke up at 6am.
Susan saw Susan buying a bike at the bike shop from 11am to 12pm.
William saw Susan stretching at a yoga studio from 12pm to 4pm.
David saw Susan taking photos near the Eiffel Tower from 4pm to 8pm.
The art studio was closed after 8pm.
Between what times could Susan have gone to the art studio?
Options:
(A) 11am to 12pm
(B) 12pm to 4pm
(C) 6am to 11am
(D) 4pm to 8pm",(C),"Based on the given information, Susan could have gone to the art studio anytime between 6am to 11am, before she went to the bike shop. Therefore, the answer is (C) 6am to 11am."
"Today, James went to the coffee shop. Between what times could they have gone?
We know that:
James woke up at 7am.
Elizabeth saw James waiting at the airport from 7am to 8am.
Kimberly saw James reading at the library from 1pm to 3pm.
Ashley saw James taking photos near the Eiffel Tower from 3pm to 7pm.
Sean saw James stretching at a yoga studio from 7pm to 9pm.
William saw James attending class at the school from 9pm to 10pm.
The coffee shop was closed after 10pm.
Between what times could James have gone to the coffee shop?
Options:
(A) 9pm to 10pm
(B) 7pm to 9pm
(C) 8am to 1pm
(D) 3pm to 7pm",(C),"Based on the information given, James could have gone to the coffee shop between 8am to 1pm or 7pm to 9pm. The coffee shop was closed after 10pm, so option (A) and (D) are not possible. Therefore, the answer is (B) 7pm to 9pm or (C) 8am to 1pm."
"Today, Tiffany went to the clothing store. Between what times could they have gone?
We know that:
Tiffany woke up at 10am.
John saw Tiffany taking photos near the Leaning Tower of Pisa from 10am to 12pm.
William saw Tiffany taking photos near the Eiffel Tower from 1pm to 6pm.
Lisa saw Tiffany driving to the water park from 6pm to 7pm.
The clothing store was closed after 7pm.
Between what times could Tiffany have gone to the clothing store?
Options:
(A) 6pm to 7pm
(B) 1pm to 6pm
(C) 12pm to 1pm
(D) 10am to 12pm",(C),"We know that Tiffany was taking photos near the Leaning Tower of Pisa from 10am to 12pm and then near the Eiffel Tower from 1pm to 6pm. Therefore, she could have gone to the clothing store between 12pm and 1pm.  The answer is option (C) 12pm to 1pm."
"Today, Andrew went to the basketball court. Between what times could they have gone?
We know that:
Andrew woke up at 6am.
Jessica saw Andrew stretching at a yoga studio from 6am to 11am.
Elizabeth saw Andrew walking in the garden from 11am to 6pm.
Emily saw Andrew watching a movie at the theater from 8pm to 9pm.
The basketball court was closed after 9pm.
Between what times could Andrew have gone to the basketball court?
Options:
(A) 11am to 6pm
(B) 8pm to 9pm
(C) 6am to 11am
(D) 6pm to 8pm",(D),"From the given information, we know that Andrew was occupied from 6am to 11am and from 11am to 6pm. Therefore, he could have gone to the basketball court between 6pm to 8pm or from 8pm to 9pm, before it closed. So, the answer is (D) 6pm to 8pm or (B) 8pm to 9pm."
